case_type,event_id,substation_id,fault_group,fault_label,risk_probability,leadtime_label,stable_crossing_lead_time_hours,leadtime_urgency,group_weight,priority_score,priority_tier,review_flag,why_reason,recommended_action
top_priority_high,3,12,control_controller,Control unit: Incorrect parameterisation,0.9854038165062012,report_time_only,0.0,1.0,1.0,99.19720990784108,high,False,위험확률 0.99; priority score 99.2; 고장군 control_controller; 당일성 신호 고장군,우선 확인: 현장/원격 점검 후보
early_leadtime_medium,10,30,leakage_water_loss,Leakage,0.9999996076326736,early_stable,168.0,0.4,0.4440425531914893,73.6606167176694,medium,False,위험확률 1.00; priority score 73.7; 고장군 leakage_water_loss; 며칠 전부터 잡히는 고장군,계획 점검: 며칠 전 신호이므로 추세 확인 후 일정 배정
early_leadtime_high,65,11,leakage_water_loss,Leakage,0.8446260072854247,early_stable,0.0,1.0,0.4440425531914893,83.11506869857071,high,False,위험확률 0.84; priority score 83.1; 고장군 leakage_water_loss; 며칠 전부터 잡히는 고장군,우선 확인: 현장/원격 점검 후보
short_leadtime_high,5,11,pump_failure,Failure of the heating circuit pump,0.9836120351232626,short_stable,24.0,1.0,0.6360425531914894,93.63930022965178,high,False,위험확률 0.98; priority score 93.6; 고장군 pump_failure; 짧은 리드타임 고장군,우선 확인: 현장/원격 점검 후보
report_time_signal_high,49,18,control_controller,Control unit: Incorrect parameterisation,0.9607645319901588,report_time_only,0.0,1.0,1.0,97.84204925945876,high,False,위험확률 0.96; priority score 97.8; 고장군 control_controller; 당일성 신호 고장군,우선 확인: 현장/원격 점검 후보
review_only_case,69,26,unknown_review,unknown,0.987606200339629,review_only,0.0,1.0,0.0999999999999999,85.81834101867959,high,True,위험확률 0.99; priority score 85.8; 고장군 unknown_review; 수동 검토 고장군; review flag 존재,수동 검토: unknown fault label이므로 자동 출동 확정 전 확인
monitor_case,11,4,valve_actuator,Motorised control valve (primary side): Actuator defective,2.2951929207164804e-06,early_stable,,0.0,0.5808936170212766,8.713530490929788,monitor,True,위험확률 0.00; priority score 8.7; 고장군 valve_actuator; 며칠 전부터 잡히는 고장군; review flag 존재,"monitor: threshold 미만 또는 근거 부족, 자동 출동 제외"
